Post,Body,Ticker,Sentiment Score,vader_score
Investing in IMAFLEX $ifx.v before EPA approval,"$ifx.v on TSX

&#x200B;

[https://www.imaflex.com/English/news-and-events/press-releases/press-release-details/2021/Imaflex-Reports-Strong-Q1-2021-Results-and-Provides-Business-Update/default.aspx](https://www.imaflex.com/English/news-and-events/press-releases/press-release-details/2021/Imaflex-Reports-Strong-Q1-2021-Results-and-Provides-Business-Update/default.aspx)

&#x200B;

https://preview.redd.it/3k0saqedjve71.png?width=1266&format=png&auto=webp&s=6bdeffae7be3eb2c2c8a16788fada436f874d78d

[https://www.imaflex.com/English/news-and-events/press-releases/press-release-details/2021/Imaflex-Announces-Positive-Independent-Results-for-the-ADVASEAL-Release-Study/default.aspx](https://www.imaflex.com/English/news-and-events/press-releases/press-release-details/2021/Imaflex-Announces-Positive-Independent-Results-for-the-ADVASEAL-Release-Study/default.aspx)",,5,0.4767
"U.S. Department of Commerce, Bureau of Economic Analysis, and Congressional Budget Office release reports proving the economy has taken massive downturn Q2, and admits inflation and GDP growth will surpass ""unsustainable levels"" by the end of the year. 2011 CBO projections v.s. 2021 actual numbers","2011 Congressional Budget Office projections v.s. the actual 2021 Budget numbers for Jan-July 2021 

In August 2011 during the debt ceiling crisis, the Congressional Budget Office (CBO) projected that the federal budget would show a deficit of close to $1.5 trillion, or 9.8 percent of GDP. 

That is nearly 1 percentage point higher than the shortfall recorded in 2010 and almost equal to the deficit posted in 2009, which at 10.0 % of GDP was the highest in nearly 65 years at the time. 

As of 8/1/21 we are entering a new debt ceiling crisis with congress on a 6 week vacation, combined with an expired rent moratorium where 6.2 million renters face evictions, the homeowners of said tenant's houses will likely never receive back-pay for rent owed possibly causing record high bankruptcies akin to 2008 or worse, and without taking this into account, CBO projects a federal budget deficit of $3.0 trillion this year as the economic disruption caused by the 2020–2021coronavirus pandemic, while the legislation enacted in response continue to boost the deficit (which was large by historical standards even before the pandemic).  

<I applaud you for making it through the longest sentence in history 👏>

At 13.4 % of gross domestic product (GDP), the deficit in 2021 would be the second largest since 1945, exceeded only by the 14.9 % shortfall recorded in 2020. 

For the period of economic expansion from the second quarter of 2009 through the fourth quarter of 2019, real GDP increased at an annual rate of 2.3 %.

For the period of economic expansion from the second quarter of 2020 through the first quarter of 2021, real GDP increased at an annual rate of 14.1 % which in my opinion and as shown below by these reports is due to the insanely high level of newly printed money and covid stimulus payments. 

https://www.cbo.gov/publication/21999

However the CBO estimates from 2011 would be heaven compared to the reality we're facing, which is a crippled economy and stock market on the verge of collapse. Evidence below; 

In 2011 CBO projected the 3 month Treasury bill to be worth 4.4% in 2021. 

The actual 3 month Treasury bill rate for July 2021 is worth between 0.01 and 0.06%.

In 2011 the projected 10 year Treasury note bill rate was projected to be 5.4% for 2021

The actual 10 year Treasury note bill rate is 1.24% In July 2021

https://www.cbo.gov/sites/default/files/112th-congress-2011-2012/reports/year-yearforecast110125.xls

7/29/2021 Report Released by the U.S. Department of Commerce, Beureau of Economic Analysis, on the Gross Domestic Product, Second Quarter 2021

Personal Income

A report by the Beureau of Economic Analysis, BEA, shows that the 2nd quarter of 2021 has been a bloodbath in terms of loss of income, savings, and increased expenses for the average American. 

""Current-dollar personal income decreased $1.32 trillion in the second quarter, or 22.0 percent, in contrast to an increase of $2.33 trillion (revised), or 56.8 percent, in the first quarter of 2021.""

This means that income literally was cut by nearly 22% on average in 2nd quarter of 2021. 

Disposable personal income decreased $1.42 trillion, or 26.1 percent, in the second quarter, in contrast to an increase of $2.27 trillion, or 63.7 percent (revised), in the first quarter. 

Real disposable personal income decreased 30.6 percent in Q2, in contrast to an increase of 57.6 percent in Q1.

This means that (money considered as non-essential to bills, insert eye roll here) decreased by over $890 billion for Americans. 

Personal outlays increased $680.8 billion in Q2, after increasing $538.8 billion for Q1. 

This means that expenses have increased by $150+ Billion in average from Q1 2021 to Q2 2021. 

Personal saving was $1.97 trillion in the second quarter, compared with $4.07 trillion (revised) in the first quarter.  

The personal saving rate—personal saving as a percentage of disposable personal income—was down to 10.9 percent in the second quarter, compared with 20.8 percent in the first quarter.

This means Americans have lost $3 TRILLION in savings Q2 2021 vs Q1 2021. That's a 10 percent decrease in savings in Q2 2021. 

Inflation seems to be the only thing that's going up this quarter and it's doubled. 

""The price index for gross domestic purchases increased 5.7 percent in the second quarter, compared with an increase of 3.9 percent (revised) in the first quarter...
 
The PCE price index increased 6.4 percent, compared with an increase of 3.8 percent in the 1st quarter. 

Excluding food and energy prices, the PCE price index increased 6.1 percent (in Q2), compared with an increase of 2.7 percent in Q1 2021""

https://www.bea.gov/news/2021/gross-domestic-product-second-quarter-2021-advance-estimate-and-annual-update

5/1/2021 
Report Released by the U.S. Department of Commerce, Bureau of Economic Analysis, on GDP and the Economy for
Q1 2021

GDP by Expenditure

The acceleration in real GDP growth in the first quarter reflected artificial economic strength.

The GDP is primarily based in the continued economic recovery from the COVID-19 pandemic as government assistance payments were distributed to households and businesses. An acceleration in consumer spending and upturns in federal as well as state and local government spending more than accounted for the acceleration in real GDP. 

These were partly offset by downturns in private inventory investment and exports and by decelerations in residential fixed investment and nonresidential fixed investment. Imports slowed.

The Truth of the US Economy by the U.S. Department of Commerce, Bureau of Economic Analysis;

The acceleration in consumer spending reflected an upturn in spending on goods and an acceleration in spending on services.

Within goods, all components of both durable and nondurable goods contributed to the upturn. The leading contributors were upturns in spending on motor vehicles and parts as well as on food and beverages purchased for off-premises consumption.

Within services, the leading contributors to the acceleration were upturns in spending on food services and accommodations and on transportation services.

An upturn in federal government spending was the second largest contributor to the acceleration in real GDP. The upturn primarily reflected an upturn in nondefense spending on intermediate goods and services purchased by government. In the first quarter, the processing and administration of Paycheck Protection Program loan applications by banks on behalf of the federal government added approximately $13.2 billion ($52.6 billion at an annual rate) to nondefense services. Federal government purchases of COVID-19 vaccines for distribution to the public contributed to the upturn in nondefense goods.

The upturn in state and local government spending reflected an upturn in consumption expenditures, led by compensation of employees, that was partly offset by a downturn in gross investment, led by a downturn in structures.

The downturn in private inventory investment was led by a larger decrease in retail trade and a downturn in manufacturing. Within retail trade, the largest contributor was a larger decrease in inventory investment by motor vehicle dealers. Within manufacturing, there were downturns in both durable and nondurable goods manufacturing inventory investment.

The downturn in exports reflected downturns in both goods (led by a deceleration in industrial supplies and a downturn in foods, feeds, and beverages) and services (led by a deceleration in transport and a downturn in royalties and license fees).

Residential fixed investment slowed, largely reflecting a slowdown in new residential structures, notably single-family units, and a downturn in brokers' commissions.

Nonresidential fixed investment slowed, reflecting a slowdown in investment in equipment that was partly offset by a smaller decrease in investment in structures. Investment in intellectual property products grew at about the same rate as in the fourth quarter.

The slowdown in equipment investment was more than accounted for by a slowdown in transportation equipment that was partly offset by an acceleration in information processing equipment.

The smaller decrease in structures was more than accounted for by a smaller decrease in investment in industrial structures.

Imports slowed. As a subtraction in the calculation of GDP, imports contributed to the acceleration in first-quarter GDP. The main contributor was a downturn in automotive vehicles, engines, and parts 

https://apps.bea.gov/scb/2021/05-may/0521-gdp-economy.htm

July 21, 2021 
CBO released report: ""Additional Information About the Updated Budget and Economic Outlook: 2021 to 2031""

""As the pandemic eases and demand for consumer services surges, real (inflation-adjusted) GDP in CBO’s projections grows by 7.4 percent this year and surpasses its potential (maximum sustainable) level by the end of the year."" -direct quote. 

A.K.A a market crash is insinuated by CBO and they directly state that the GDP of this nation surpassing maximum sustainability!!!

https://www.cbo.gov/publication/57263

The Debt Ceiling Dillema 

""A two-year deal to suspend the debt ceiling lapsed at midnight (7/31/21) following inaction from Congress and President Biden to give the U.S. more borrowing authority. The Treasury Department will now begin taking what it refers to as ""extraordinary measures"" to prevent the U.S. from defaulting on its debt.""

""Republican leaders have told Democrats that there can be no bipartisan debt ceiling agreement without a slate of debt reduction measures targeting the roughly $28 trillion national debt. Several GOP lawmakers have floated a deal similar to the 2011 Budget Control Act, which ended a debt ceiling standoff shortly before the U.S. suffered its first ever credit downgrade.""

CBO says, ""the Treasury would probably run out of cash sometime in the first quarter of the next fiscal year (which begins on October 1, 2021, most likely in October or November, the Congressional Budget Office estimates. If that occurred, the government would be unable to pay its obligations fully, and it would delay making payments for its activities, default on its debt obligations, or both.

The timing and size of revenue collections and outlays over the coming months could differ noticeably from CBO's projections. 
Therefore, the extraordinary measures could be exhausted, and the Treasury could run out of cash, either earlier or later than CBO projects.

Yellen has also said uncertainty driven by the coronavirus pandemic and the federal government's fiscal response has made it harder to pin down exactly how long the U.S. to avoid a default.""

Yellen stated that the default could happen as soon as early September. 

This means we could see the US Treasury's ability to pay almost all bills completely crippled well before Congress' return to duty as they just began a 6 week vacation on 7/31/21.

https://thehill.com/policy/finance/565745-missed-debt-ceiling-deadline-kicks-off-high-stakes-fight

Our GDP is a complete farce that was being held up by stimulus payments, government covid spending, Repurchase/Reverse Repurchase Agreements of Treasury Bills to the tune of now over $1 Trillion per day, imports and exports are down huge while sea ports are more severely congested than ever before as are airline cargo carriers. Mortgage applications, sales, and broker commissions are down heavily, trucking rates are at all time highs with minimal availability especially for ocean and rail drayage, warehouse storage for said freight is at all time lows with prices at all time highs due to supply and demand, retail trade and manufacturing are down significantly as well in Q2.  Consumer spending is down as well as savings to lows not seen in many years as well

Essentially the bubble from stimulus has already been popped.  It's only a short matter of time before we see the effects on our country.

A 2015 report from the Government Accountability Office analyzing the 2013 debt ceiling standoff found that ""investors reported taking the unprecedented action of systematically avoiding certain Treasury securities,"" which are considered almost as safe as cash, causing widespread issues across credit markets.

""Industry groups emphasized that even a temporary delay in payment could undermine confidence in the full faith and credit of the United States and therefore cause significant damage to markets for Treasury securities and other assets,"" the report said.

The last 2 times the debt ceiling crisis occurred in 2011 and 2013, rating agencies to re-evaluate the rating of US government debt.

On October 15 2013, Fitch Ratings placed the United States under a ""Rating watch negative"" in response to the crisis. 

On October 17 2013, Dagong Global Credit Rating downgraded the United States from A to A−, and maintained a negative outlook on the country's credit.

In 2013 while lawmakers and the Obama Administration came to an agreement on the debt ceiling, from September 19th to October 9th, the S&P 500 moved below its 50 day moving average and the SPY lost 5.2%.

On 8/9/2011 during the Debt Ceiling Crisis
The Dow Jones Industrial Average plunged 634.76 points as approximately $2.5 TRILLION was erased from global equities.

That's $2,500,000,000,000.00 in one day. 

The S&P 500 Index lost 6.7 per cent to 1,119.46, its lowest level since September, as all 500 stocks fell for the first time since Bloomberg began tracking the data in 1996.


...What does this mean? I plan to invest heavily in stonks that have inverse beta, such as good old volatility, movie, and game stonks because when the market goes down, they'll come up...",U,0,0.5859
120k YOLO 60k BABA 60k PLTR. To the moon fellow apes 🦍 🦍 🚀,,PLTR,20,0.4278
"CNBC: Square to buy Australia's Afterpay in $29 billion deal as 'buy now, pay later' trend takes off.",,,10,-0.1027
Another view,,,0,0.0
Walgreens Bollinger Squeeze,"Walgreens looks extremely healthy right now, it looks like we're headed towards a Bollinger Squeeze and can see an easy 10% gain here.

[Bollinger Squeeze happening](https://preview.redd.it/4almw2iuzue71.png?width=764&format=png&auto=webp&s=698a0253f9834e46db59c353484ae678065845de)

I have my orders queue'd for the morning. We're currently sitting on a major support level, this is as low as you can get in. It can shoot higher, but 10% is a safe bet here as it retests previous resistance areas.

[current price\/support level vs resistance. ](https://preview.redd.it/ij2o744vzue71.png?width=1575&format=png&auto=webp&s=d90960e983fd7f61b920f00ddb9f6b085324d1d1)

Walgreens still hasn't fully recovered from Covid crash, and this looks like a clean entry for some easy profits.

NFA. Just my 2 cents. do your own research.  


For those who don't know know how to pull up charts / would rather comment that these are not the same graph. [https://www.tradingview.com/chart/?symbol=NASDAQ%3AWBA](https://www.tradingview.com/chart/?symbol=NASDAQ%3AWBA)",,0,0.0
French carmakers lose hope for rebound in sales as global chip shortage & surge in Covid-19 cases drag market down.,,,0,-0.4019
Once In A Lifetime Hog Future Opportunity In California,"As the beginning of next year, California will enforce new animal welfare law for breeding pigs and other farm animals. But only 4% of the hog operations currently can comply. According to one farmer, to meet the new standard, he needs 3 million for the upgrade to raise just 250 hogs. Restaurants owners are worried because bacon is one of the most popular breakfast items and bacon helped their business survive the pandemic. ([https://www.bloomberg.com/news/articles/2021-07-31/bacon-may-disappear-in-california-as-pig-rules-take-effect](https://www.bloomberg.com/news/articles/2021-07-31/bacon-may-disappear-in-california-as-pig-rules-take-effect?srnd=premium)).  People love bacon from all backgrounds. ""You know, I work and live with a lot of Asian and Hispanic populations in the city and their diet consists of pork bacon. Pork bacon is huge,"" Kim said. ""It’s almost like bread and butter.""

Bacon love is ingrained into our soul and genetics and therefore an inelastic demand. A small change in bacon supply can lead to a drastic change in price, as explained by graph below.

[Inelastic Demand Price Action](https://preview.redd.it/huc5pz6xoue71.jpg?width=570&format=pjpg&auto=webp&s=fcea15c61d5e19157c1cfb07d1e9684142bf67c2)

According to consulting firm Hitamiya Group, if half of the pork supply was lost, bacon price would jump 60% which means a $6 package could rise to $9.60 cents ([https://www.bloomberg.com/news/articles/2021-07-31/bacon-may-disappear-in-california-as-pig-rules-take-effect?srnd=premium](https://www.bloomberg.com/news/articles/2021-07-31/bacon-may-disappear-in-california-as-pig-rules-take-effect?srnd=premium)). If 90% - 95% of the supplies are gone, the fair price should be at least 2.5 times the current market value. And that means **1 package of bacon is $15 per package.**

You must wonder, how do I profit from this? A very ancient trade technique - BUY LOW SELL HIGH

I am not talking about buying 10 packs of bacon from Costco and resale them later. I am talking about doing it at scale. Go big or go home.

**Step 1 - Install Freezers in Your Garage**

Let’s figure out how many freezers you can potentially have. First park your cars on the street and empty the garage. The average garage size is 12 feet \* 22 feet \* 8 feet. So 12 \* 22 \* 8 = 2112 cubic feet.

The below fridge dimension is 37.25 x 20.75 x 33.25 inches and can storage up to 7 cubic feet items.

[ Ideal Fridge to Keep Bacon](https://preview.redd.it/yfk3jbp3que71.jpg?width=1282&format=pjpg&auto=webp&s=731f5da26e2187ec37b1dbd4fbabc5b7789ebd15)

Let’s do more math to see how many fridges your garage can potentially store.

2112 (volume of garage) \* 1728 (1 cubic feet is 1728 cubic inch) / 37.25 \* 20.75 \* 33.25 (volume of fridge) = **142 fridges**

Obviously you can’t just stack all of those fridges in the garage. Let’s say we can achieve 80% of that. And that means you can have around **110 fridges.**

Remember to use Amazon FREE SHIPPING. Very important to save cost.

**Fridge Cost with Tax**: 110 \* 229 \* 1.1 (Uncle Sam wants the tax) = **$27709**

|**Item**|Cost|
|:-|:-|
|110 Fridges|$27709|

**Step 2 - Buy Bacon in Bulk and use FREE SHIPPING**

According to USDA ([https://www.ers.usda.gov/data-products/meat-price-spreads/](https://www.ers.usda.gov/data-products/meat-price-spreads/)), one package (1 pound) of bacon in  June 2021 is about $6.67. We can get this much lower by buying from Costco in BULK. As you can see below, **our one package cost is $4.53** AFTER tax including delivery. Again, very important to use free shipping to save cost.

[Bacon Price From Costco](https://preview.redd.it/4a12382erue71.png?width=1840&format=png&auto=webp&s=48f5dacba1eb055847e3b266aef24fb5abcee393)

It's time to calculate how much to buy. The size of one package of bacon is about 10 inch \* 4 inch \* 1 inch so 40 cubic inch. And the volume of our fridge is 7 cubic feet which is 12096 cubic inch. So one fridge can store around 300 packages or pounds of bacon. With 110 fridges, we can store 33000 packages or pounds of bacon. Each pound of bacon is $4.53, so the total cost of bacon is $149,490

Total Cost So Far

|**Item**|Cost|
|:-|:-|
|110 Fridges|$27709|
|33000 packages or 2200 cases of bacon|$149,490|

**Step 3 - Factor In the Electricity Cost**

Running 110 freezers in the garage is apparently very energy consuming and electricity is expensive in California, at about 20 cents / kWh.

The freezer is 150 watts so running 110 freezers for let's say 6 months will cost $14256. You can check my math below:

150 watts \* 6 (month) \* 30 (days) \* 24 (hours) / 1000 = 648 kWh (one fridge running a year energy consumption)

648 kWh \* 0.2 cents / kWh \* 110 = $14256

Total Cost So Far

|**Item**|Cost|
|:-|:-|
|110 Fridges|$27709|
|33000 packages or 2200 cases of bacon|$149,490|
|Electricity|$14256|

Step 4 - Sell High And Take Profits

Don't diamond hand bacon, you are in 2022 and it's time to sell for a profit!

The cost of bacon per package factoring in everything so far is **$5.8.** And we unload each package for $15. So that means each package profit is $9.2.

# The total profit is $9.2 * 33000 = $303,600

If you too lazy to contact customers or answer phone calls yourself, just hire someone for like 20K a month to the work for you. I expect the inventory goes to zero in a month so at the end of the day, you pocket close to $280,000 profits.

And you can figure out the tax part and probably can resell those freezers for half the price.

TLDR: Buy Bacon Now and Get Rich Later",,5,0.4215
Down almost 30k on workhorse,,,0,0.0
