Post,Body,Ticker,Sentiment Score,vader_score
What's really going on with inflation?,"In June 2021 inflation increased **5.4%** compared to June 2020 ([official release](https://www.bls.gov/news.release/cpi.nr0.htm)).

&#x200B;

If we look at who were the main contributors of inflation, we see that *Used Cars & Trucks* increased **10%** from March to April, **7.3%** from April to May and **10.5%** from May to June. The weight of *Used Cars & Trucks* in the CPI is 3.166% (see Relative Importance column [here](https://www.bls.gov/news.release/cpi.t02.htm)), which means that in the last three months, **0.96%** of the CPI increase was due to an increase in prices of *Used Cars & Trucks*.

&#x200B;

The issue seems to be the global semiconductor shortage, that is slowing the production of Cars in the US and worldwide (for example: [here](https://www.bloomberg.com/news/articles/2021-07-16/record-used-car-prices-can-t-keep-buyers-away)). I'm however wondering if this is true (or fully true). If we look at the price increase for new cars, we can see that the price increase is ""just"" 5.3% compared to last year. Why would used cars prices increase 45% in one year while the new cars prices increased just by 5.3%? If there is a global shortage, shouldn't the prices of new cars also skyrocket?

[\(The first column is the weight in CPI, the second column is the YoY price change\)](https://preview.redd.it/hvkpfvznvqe71.png?width=834&format=png&auto=webp&s=080f3e70cbe2109e47b0eb14fd703204be09cd8f)

I also checked the how prices of electronic devices (such as smartphones, PCs, etc.) changed in the last year. In the image below you can see their prices deceased by 17.8%. So if there is a global shortage of chips that slowed down the production of cars and therefore increased the price of used cars, why price of electronic devices didn't increase accordingly?

[\(The first column is the weight in CPI, the second column is the YoY price change\)](https://preview.redd.it/h5gkptzrvqe71.png?width=818&format=png&auto=webp&s=2ce4268562d01db3fe0d270a7a62c29ef5e58fcc)

Finally, if we look at how the cost of renting cars and trucks increased over the last year, we see it increased by a whopping 87.7%, of which 45% just in the last 3 months.

[\(The first column is the weight in CPI, the second column is the YoY price change\)](https://preview.redd.it/dy59zcnuvqe71.png?width=837&format=png&auto=webp&s=ad878d60d821705920a83cf078bd476084d2fc41)

So my theory is that partially the increase is due to the semiconductor shortage, but most of the recent increase in used and cars prices, is the fact that due to re-opening economy people are traveling more and therefore renting more cars. As [this article](https://edition.cnn.com/travel/article/europe-car-rental-carmageddon-cmd/index.html) mentions:

&#x200B;

*""Essentially, car hire companies tend to order their fleets about two or three months in advance, at the start of the year -- and, having been stung with the low demand last year, they hedged their bets this year.*

*In fact, Sixt confirmed to CNN that its latest figures show that for Q1 of 2021, it had 93,200 cars across its global network. That compares to 130,900 in Q1 of 2020, and 129,200 for the same period in 2019. That's a 29% decrease in vehicles, year on year.""*

&#x200B;

If you look at how the increases in car prices happened, the increase is mostly happened in the last 3 months, with the coming of summer, while before the increases were minimal, while the global semiconductor shortage was well known already in Q4-2020. So should we expect this increase in Used Cars & Trucks to vanish by the end of the summer?

&#x200B;

I'd be happy to hear your thoughts.",,0,0.0
China is playing the long-game; US is running on band-aids,"China is not trying to kill their big tech, they are trying to make their business models more long-lived and sustainable both financially and socially.

It is definitely trying hard to create a more conservative financial system while contributing to a more equal distribution of wealth. Say what you want, but that ain't bad news at all if you're a long term investor.

China wants to rely less on foreign fund flows because they see high speculation and bubble activity in Western countries and they don't want their domestic companies to be exposed to that euphoria and collapse risk. It's easy for a company to act recklessly in such an environment, and these reckless acts might ruin the Government's efforts towards a stable and healthy growing market.

Remember, China is a country lead by a collectivist mindset where the good of the mass is more important than the good of a single company or individual (which will frequently lead to abuse of the few for the many, in direct opposition to the policy of the US government which easily sacrifices the many for the few on top (not so much Western Europe). In the end the collective good turns out to be the company's best interest too.

They are not oblivious to the effects these measures have on the markets, even going as far as to post ads on the front page of every newspaper claiming that they are not in any way trying to harm tech companies, but actually helping them become more sustainable and resilient.

&#x200B;

Was the crackdown on education stocks really a surprise?

In April the government released a document analyzing the education system of the country and already pointing out the problems they saw and possible corrective measures.

If somebody read those (and they should have if they owned the companies) they could have anticipated the sector to be caught in the regulation crossfire. But people don't do their due diligence and always act surprised when things go south. China is always clear about its intentions, we're just unable to understand them because we keep thinking in Western terms and taking our society and the companies we know as the ""default"" condition, which is fundamentally wrong.

Was the crackdown on Didi a surprise too?

Absolutely not. The government had explicitly recommended Didi delayed their IPO until certain data issues had been dealt with. Their main concern was making sure data breaches were avoided since, well, the US is literally their main competitor.

Didi ignored all this and went ahead. What followed was more than expected.

&#x200B;

I'm not pretending their totalitarian government that seeks to have absolute control over everything and every piece of information and conducts ethnic cleansing is in any way the most advanced form of human governance.

I'm simply pointing out that it is doing what it is doing because it wants to secure a strong and steady growth for its companies, and it knows that can only be achieved if it does not come at the expense of impoverishing its population and compromising healthy competition and fair-play in all sectors.

Only the western investor deeply embroiled in never-ending ATH's and euphoria can view the sustainable long-term measures as unsustainable and the unsustainable short-term bandaids as sustainable.

&#x200B;

EDIT: Now this is what I call a controversial fucking post. I guess time will tell.

The casino doesn't care about your stupid borders and your Murica koolaid, and neither do I.

&#x200B;

Chinese positions: $DOYU 450 shares",,10,0.2023
"Daily Popular Tickers Thread for August 01, 2021 - GME | AMD | AMC","
Your daily hype thread. Please keep the shitposting to a maximum.

^Navigate ^WSB |^We ^recommend ^best ^daily ^DD
:--|:--                                 
**DD** | [All](https://reddit.com/r/wallstreetbets/search?sort=new&restrict_sr=on&q=flair%3ADD) / [**Best Daily**](https://www.reddit.com/r/wallstreetbets/search?sort=top&q=flair%3ADD&restrict_sr=on&t=day) / [Best Weekly](https://www.reddit.com/r/wallstreetbets/search?sort=top&q=flair%3ADD&restrict_sr=on&t=week)
**Discussion** | [All](https://reddit.com/r/wallstreetbets/search?sort=new&restrict_sr=on&q=flair%3ADiscussion) / [**Best Daily**](https://www.reddit.com/r/wallstreetbets/search?sort=top&q=flair%3ADiscussion&restrict_sr=on&t=day) / [Best Weekly](https://www.reddit.com/r/wallstreetbets/search?sort=top&q=flair%3ADiscussion&restrict_sr=on&t=week)
**YOLO** | [All](https://reddit.com/r/wallstreetbets/search?sort=new&restrict_sr=on&q=flair%3AYOLO) / [**Best Daily**](https://www.reddit.com/r/wallstreetbets/search?sort=top&q=flair%3AYOLO&restrict_sr=on&t=day) / [Best Weekly](https://www.reddit.com/r/wallstreetbets/search?sort=top&q=flair%3AYOLO&restrict_sr=on&t=week)
**Gain** | [All](https://reddit.com/r/wallstreetbets/search?sort=new&restrict_sr=on&q=flair%3AGain) / [**Best Daily**](https://www.reddit.com/r/wallstreetbets/search?sort=top&q=flair%3AGain&restrict_sr=on&t=day) / [Best Weekly](https://www.reddit.com/r/wallstreetbets/search?sort=top&q=flair%3AGain&restrict_sr=on&t=week)
**Loss** | [All](https://reddit.com/r/wallstreetbets/search?sort=new&restrict_sr=on&q=flair%3ALoss) / [**Best Daily**](https://www.reddit.com/r/wallstreetbets/search?sort=top&q=flair%3ALoss&restrict_sr=on&t=day) / [Best Weekly](https://www.reddit.com/r/wallstreetbets/search?sort=top&q=flair%3ALoss&restrict_sr=on&t=week)","GME,AMD,AMC",0,0.4215
QS Management Team is so confident on their final success,"Quote from the latest earnings call:

 **John Saager**

The remainder of these questions are from the Say app. Sales of stock by key team members are being perceived by some as extreme with one shareholder claiming that our CTO, Tim Holme, sold 50% of his holdings. Noting that our Chief Legal Officer sold shares and our Chief Development Officer sold two-third of his shares. So the question becomes, is there anything to read into those share sales? And can you comment on the size of the share sale?

**Kevin Hettrich**

John, first, the percent of sale references in the questions are not accurate to correct the record here. As of the end of the quarter, Tim, our Co-Founder and Chief Technology Officer, holds 96% of its prior holdings; as of June 30, 2021, Mohit Singh, our Chief Development Officer, holds 86%; and Mike McCarthy, our Chief Legal Officer holds 83%.

**Jagdeep Singh**

Yes. If I can just add, as I mentioned on our last call, outside of satisfying tax obligations, I remain committed to not selling any shares until we've delivered a prototype in a commercially relevant form factor to Volkswagen.",QS,5,0.8323
"People who shorted $Hood (Honey, you got a big storm coming remix)",,,0,0.0
short or stay clear of TLRY,"TLRY has become a meme stock with not much behind it. they put out great headlines but at the end of the day, they aren't doing well enough to any way justify their valuation. and this has been going on for awhile. 

a quick look at their fins says it all. before merger

aphria sold 41m usd in weed last quarter
tlry sold 31 million

after merger, they recently reported 52m in weed sales which accounted for 100% apha and 4wks worth of tlry. which meant they were flat in sales qoq. these are like tier 3 mso numbers. 

on top of which, they're carrying about 3b in good will (most of it came from tlry) and 250m of weed inventory.  at their sales rate, it would take them over 2yrs to sell that. more than likely they would need to write down a signifcant portion of that inventory at some point. 

and they're valued at 7b. 

now they're looking to dilute further for some red herring that looks like mso acquisition but still smells like herring. truth is 1) they need to continue to acquire to grow rev to (hopefully, but doubtful)  justify their valuation since they can't sell weed (remember flat qoq growth and ballooning inventory) 2) they can't afford a tier 1 or 2 mso. 

institutional investors only hold about 10% of their float which is among the lowest of their peers. hell even aurora is 18% (which, in itself, is lunacy). canopy is about 25%. village farms near 40%. 10% are mso numbers and msos trade on the OTC where most funds can't invest!

skip the company pr, look at the official fins, check out their valuation, compare their numbers to any mso, and you'll come to the same conclusions. 

oh, and the current ceo makes outlandish money https://www.reddit.com/r/weedstocks/comments/ouspzi/-/h762qcd.  note that the old tlry ceo Brendan Kennedy continues to dump his shares faster than you can say weedstocks. the guy is no dummy https://wallmine.com/people/64826/brendan-kennedy

the only upside is that they're heavily shorted so can run up wildly like we saw with their recent er. but once people digested their fins (which were released after hours when their headline numbers were released premarket lol), looks like reality is setting in. 

caveat emptor",TLRY,0,0.3818
"Fraternal Association of Gambling Gentlemen and Yacht Degenerates for August 01, 2021","Inductions
------


----------
User|Cast Vote|Voters
:--|:--|:--
**None**

Ejections
------


----------
User|Cast Vote|Voters
:--|:--|:--
**None**



---
FAQ
------

Only approved users can participate here. They can induct and eject other users which will be displayed publicly as it is happening in the above tables. Anyone on the approved users list (which you cannot see) will be ignored entirely by /u/VisualMod and most of the AutoModerator rules for all comments and submissions, so bestow this status on people wisely to accrue traders and bros to the thread.
Five affirmative votes are required to induct or eject someone. Simply click one of the links below and put their username (no /u/) in the body of the message.

[**Begin Induction**](https://www.reddit.com/message/compose/?to=VisualMod&subject=induct) | [**Begin Ejection**](https://www.reddit.com/message/compose/?to=VisualMod&subject=eject)

You can get a DM when the new thread pops up by commenting !subscribe.",,0,0.0
Once In A Lifetime Opportunity For Tech Stocks,"Just heard from friends in China there are over 200 cases in Nanjing, the capital city of Jiangsu. Regional lockdowns are happening. Florida just had over 20K cases in a day, the worst day since the pandemic started. 

Covid is far from over and we probably will go through another circle of rotating into tech and then rotating into “recovery” plays. 

As long as the covid is not over, JPOW is unlikely to taper. And the longer this pandemic stretches, the more the world will adopt technologies. And more will move from offline to online. Calls on AAPL for all kinds of electrical devices. 

After more people adopt technologies, more companies will upgrade their tech stacks to meet the new service traffic and reliability demand. Calls on tech cloud and infrastructure companies like AMZN. 

And once the world adopts technologies, it won’t be able to leave and tech just have that sticky magic. 

TLDR: Tech gonna moon and it just started. Covid is terrible for public health but it accelerated tech adoption by at least 10 years.",,5,0.4215
Call debit spreads,"I have seen a lot of loss porn on here, I wondered if anyone is using call debit spreads before yoloing their life savings on here... it seems like a solid strategy, if not can you run me through the reasons against not using this strategy? Honestly I came to be more aware of what options are through this subreddit and I don't really follow these methods but I do appreciate the desire to learn more that was sparked by this community. Anyway, im not any kind of expert but I hadn't heard this method mentioned much here.

For anyone who's unfamiliar, just the basic idea of buying a call and then selling a call roughly an additional $40 or $50 out of the money away from strike price to lower the break even price.",,0,0.0
There is a risk I'm overlooking and I'm asking for your help to find it. I think I found free money and don't want to be the next 1r0nyman.,"I've traded options for a couple years, mostly using theta decay strategies (the wheel, sometimes OTM spreads) and rarely buying far OTM calls and puts as lottery ticket plays. I've never done much with ITM options outside of buying them for leverage using LEAPS.

Here's my thesis:

I want to make an outsized bet that there will be some black swan event soon that could send the market toppling, or that inflation will start to get out of control fast and JPOW will do a 180 and go Paul Vlocker on this party and brutally murder the bull.

In the event of raising interest rates or a sudden and severe downturn, I suspect zombie companies will start to blow up left and right. The HYG ETF is comprised of junk bonds, many of which are companies I would consider teetering, especially if we have a rapid onset recession or rapid interest rate increases.

I was looking into selling ITM call credit spreads as a way to short the fund, with limited loss potential and without having to payout the dividend, pay borrow fees, or margin interest like I would if I was directly short.

Looking at specifically selling the $70c and buying the $88c for as close to $18 a spread as I can get. Experation can be variable but I'm looking for in the next 6 months.

Let's say I'm able to sell this spread for $17.95 and I sell 1000 of them. That's $1,795,000 in premium collected. If HYG collapses below $70c before expiration most of the intrinsic value will evaporate and I can close anywhere between break even and a $ million + payday. If I'm wrong I lose $0.05 ($5 per contract) per spread plus commission costs. ($5000 + $1300). So for a max loss of $6300 I could potentially make up to $1.7 million by shorting junk bonds when everyone is uncertain of the future.

The only risk I see is if I get assigned early, I'll have to exercise my long leg early to cover the short created on my assigned short call. Even in this case I only lose $5 per contract that gets assigned early on me.

The other ""risk"" I see is there's no way I can get filled that close to the risk free rate. ($18 a spread between $70c and $88c) maybe I'll have to adjust to $17.90 in which case max loss is $11,300. Or $17.85 where max loss is $16300.

So long as I can get reasonably close it seems like an absolute insane payout for just taking on early assignment risk.

What am I missing?

Am I really that likely to get assigned early on my short $70c leg?

Any input would be greatly appreciated.",,10,0.5687
Harassment priced in? : Couple sues eBay alleging harassment including death threats by employees,,,0,-0.9287
